Kod,Unvan,City,BagimsizDenetim,Url,centerAddress,electronicEmailAddress,internet,companyTime,bagimsizDenetimKurulusu,dahilOlduguEndeksler,Sektor,islemGorduguPazarlar
OZRDN,ÖZERDEN AMBALAJ SANAYİ A.Ş.,İSTANBUL,ULUSAL BAĞIMSIZ DENETİM VE YEMİNLİ MALİ MÜŞAVİRLİK A.Ş.,https://www.kap.org.tr/tr/sirket-bilgileri/ozet/2432-ozerden-ambalaj-sanayi-a-s,REŞİTPAŞA MAH. ESKİ BÜYÜKDERE CAD. WINDOWIST BLOK NO: 26 /12 SARIYER / İSTANBUL,yi@ozerden.com,www.ozerden.com,Süresiz,ULUSAL BAĞIMSIZ DENETİM VE YEMİNLİ MALİ MÜŞAVİRLİK A.Ş.,"BIST SINAİ / BIST TÜM-100 / BIST ANA / BIST KOCAELİ / BIST 500 / BIST KOBI SANAYİ / BIST KATILIM TUM / BIST KİMYA, PETROL, PLASTİK / BIST TÜM",İMALAT / KİMYA İLAÇ PETROL LASTİK VE PLASTİK ÜRÜNLER,ANA PAZAR
OZSUB,ÖZSU BALIK ÜRETİM A.Ş.,İZMİR,EREN BAĞIMSIZ DENETİM A.Ş.,https://www.kap.org.tr/tr/sirket-bilgileri/ozet/4748-ozsu-balik-uretim-a-s,Demircili Mahallesi Demircili Cad. N42 Urla/İzmir,yatirimciiliskileri@ozsubalik.com.tr,https://www.ozsubalik.com.tr/,Süresiz,EREN BAĞIMSIZ DENETİM A.Ş.,BIST SINAİ / BIST TÜM-100 / BIST İZMİR / BIST TÜM / BIST KATILIM TUM / BIST ANA / BIST 500 / BIST HALKA ARZ,"TARIM, ORMANCILIK VE BALIKÇILIK / BALIKÇILIK VE SU ÜRÜNLERİ",ANA PAZAR
OZYSR,ÖZYAŞAR TEL VE GALVANİZLEME SANAYİ A.Ş.,İSTANBUL,,https://www.kap.org.tr/tr/sirket-bilgileri/ozet/5961-ozyasar-tel-ve-galvanizleme-sanayi-a-s,SEYİTNİZAM MAH. DEMİRCİLER SİTESİ CAD.10.YOL AYDAŞ İŞ MERKEZİ NO 7 B BLOK KAT 1 ZEYTİNBURNU 34015 İSTANBUL,yatirimci.iliskileri@ozyasar.com.tr,www.ozyasar.com.tr,Süresiz,,BIST HALKA ARZ / BIST İSTANBUL / BIST TÜM / BIST KATILIM TUM / BIST METAL ANA / BIST SINAİ / BIST TÜM-100 / BIST ANA,İMALAT / ANA METAL SANAYİ,ANA PAZAR
PAMEL,PAMEL YENİLENEBİLİR ELEKTRİK ÜRETİM A.Ş.,İSTANBUL,PwC BAĞIMSIZ DENETİM VE SERBEST MUHASEBECİ MALİ MÜŞAVİRLİK A.Ş,https://www.kap.org.tr/tr/sirket-bilgileri/ozet/2262-pamel-yenilenebilir-elektrik-uretim-a-s,Maslak Mah. Saat Sk. Spine Tower Sitesi No:5/93 Sarıyer / İstanbul,info@pamel.com.tr,www.pamel.com.tr,Süresiz,PwC BAĞIMSIZ DENETİM VE SERBEST MUHASEBECİ MALİ MÜŞAVİRLİK A.Ş,BIST TÜM / BIST HİZMETLER / BIST TÜM-100 / BIST ELEKTRİK / BIST 500 / BIST ANA,ELEKTRİK GAZ VE SU / ELEKTRİK GAZ VE BUHAR,ANA PAZAR
PNLSN,PANELSAN ÇATI CEPHE SİSTEMLERİ SANAYİ VE TİCARET A.Ş.,ANKARA,GÜNCEL BAĞIMSIZ DENETİM DANIŞMANLIK A.Ş.,https://www.kap.org.tr/tr/sirket-bilgileri/ozet/5487-panelsan-cati-cephe-sistemleri-sanayi-ve-ticaret-a-s,Maidan İş ve Yaşam Merkezi Mustafa Kemal Mahallesi 2118. Cadde No:4 A Blok 3.Kat Daire: 18 Çankaya / Ankara,yatirimciiliskileri@panelsan.com,www.panelsan.com,Şirket süresiz olarak kurulmuştur.,GÜNCEL BAĞIMSIZ DENETİM DANIŞMANLIK A.Ş.,BIST TEMETTÜ / BIST TÜM / BIST METAL ANA / BIST SINAİ / BIST TÜM-100 / BIST ANKARA / BIST YILDIZ / BIST 500,İMALAT / ANA METAL SANAYİ,YILDIZ PAZAR
PAGYO,PANORA GAYRİMENKUL YATIRIM ORTAKLIĞI A.Ş.,ANKARA,EREN BAĞIMSIZ DENETİM A.Ş.,https://www.kap.org.tr/tr/sirket-bilgileri/ozet/1753-panora-gayrimenkul-yatirim-ortakligi-a-s,Oran Mahallesi Kudüs Caddesi No:3/318 - Çankaya ANKARA,info@panoragyo.com,www.panoragyo.com,süresiz,EREN BAĞIMSIZ DENETİM A.Ş.,BIST KATILIM TEMETTU / BIST ANA / BIST KATILIM TUM / BIST MALİ / BIST TÜM-100 / BIST TÜM / BIST TEMETTÜ / BIST 500 / BIST GAYRİMENKUL YAT. ORT.,MALİ KURULUŞLAR / GAYRİMENKUL YATIRIM ORTAKLIKLARI,ANA PAZAR
PAPIL,PAPİLON SAVUNMA TEKNOLOJİ VE TİCARET A.Ş.,ANKARA,DENGE ANKARA BAĞIMSIZ DENETİM VE YEMİNLİ MALİ MÜŞAVİRLİK A.Ş.,https://www.kap.org.tr/tr/sirket-bilgileri/ozet/4989-papilon-savunma-teknoloji-ve-ticaret-a-s,Mebusevleri Mahallesi Ergin Sokak No:9 06570 Çankaya Ankara,yatirim@papilon.com.tr,invest.papilon.com.tr,Süresiz,DENGE ANKARA BAĞIMSIZ DENETİM VE YEMİNLİ MALİ MÜŞAVİRLİK A.Ş.,BIST BİLİŞİM / BIST TEKNOLOJİ / BIST TEMETTÜ / BIST TÜM-100 / BIST YILDIZ / BIST 500 / BIST TÜM / BIST ANKARA,TEKNOLOJİ / BİLİŞİM,YILDIZ PAZAR
PRFFK,PARAFİNANS FAKTORİNG A.Ş.,İSTANBUL,ULUSAL BAĞIMSIZ DENETİM VE YEMİNLİ MALİ MÜŞAVİRLİK A.Ş.,https://www.kap.org.tr/tr/sirket-bilgileri/ozet/4640-parafinans-faktoring-a-s,Oruç Reis Mah. Tekstilkent Cad.Koza Plaza B Blok Kat 22 Esenler / İstanbul,info@parafinans.com.tr,www.parafinans.com.tr,Süresizdir.,ULUSAL BAĞIMSIZ DENETİM VE YEMİNLİ MALİ MÜŞAVİRLİK A.Ş.,,,KESİN ALIM SATIM PAZARI-(NİTELİKLİ YATIRIMCILAR ARASINDA)
PRDGS,PARDUS GİRİŞİM SERMAYESİ YATIRIM ORTAKLIĞI A.Ş.,İSTANBUL,PKF ADAY BAĞIMSIZ DENETİM A.Ş.,https://www.kap.org.tr/tr/sirket-bilgileri/ozet/5417-pardus-girisim-sermayesi-yatirim-ortakligi-a-s,Esentepe Mah. Büyükdere Cad. Levent Plaza Blok No: 173 İç Kapı No: 30 Şişli/İSTANBUL,info@pardusgirisim.com,www.pardusgirisim.com,Süresiz,PKF ADAY BAĞIMSIZ DENETİM A.Ş.,BIST TÜM-100 / BIST MALİ / BIST ANA / BIST HOLDİNG VE YATIRIM / BIST KATILIM TUM / BIST TÜM / BIST 500,MALİ KURULUŞLAR / GİRİŞİM SERMAYESİ YATIRIM ORTAKLIKLARI,ANA PAZAR
PRKME,PARK ELEKTRİK ÜRETİM MADENCİLİK SANAYİ VE TİCARET A.Ş.,İSTANBUL,DRT BAĞIMSIZ DENETİM VE SERBEST MUHASEBECİ MALİ MÜŞAVİRLİK A.Ş.,https://www.kap.org.tr/tr/sirket-bilgileri/ozet/1049-park-elektrik-uretim-madencilik-sanayi-ve-ticaret-a-s,Sultantepe Mah. Paşalimanı Cad.No:41 34674-Üsküdar/İSTANBUL,parkelektrik@parkelektrik.com.tr --- parkelektrikuretim@hs03.kep.tr --- yatirimci.iliskileri@cinergroup.com.tr --- investor.relations@cinergroup.com.tr --- info@parkelektrik.com.tr,www.parkelektrik.com.tr,Süresiz,DRT BAĞIMSIZ DENETİM VE SERBEST MUHASEBECİ MALİ MÜŞAVİRLİK A.Ş.,BIST GERİ ALIM / BIST TÜM / BIST SINAİ / BIST ANA / BIST KURUMSAL YÖNETİM / BIST KOBI SANAYİ / BIST MADENCİLİK / BIST 500 / BIST TÜM-100,MADENCİLİK VE TAŞ OCAKÇILIĞI / KÖMÜR VE LİNYİT MADENCİLİĞİ,ANA PAZAR
PARSN,PARSAN MAKİNA PARÇALARI SANAYİİ A.Ş.,İSTANBUL,PwC BAĞIMSIZ DENETİM VE SERBEST MUHASEBECİ MALİ MÜŞAVİRLİK A.Ş,https://www.kap.org.tr/tr/sirket-bilgileri/ozet/1050-parsan-makina-parcalari-sanayii-a-s,GÜZELYALI MAH.PARSAN ÇIKMAZI SOK.NO:2/1 PENDİK/İST.,parsan@parsan.com,www.parsan.com,SÜRESİZ,PwC BAĞIMSIZ DENETİM VE SERBEST MUHASEBECİ MALİ MÜŞAVİRLİK A.Ş,"BIST KATILIM TUM / BIST YILDIZ / BIST TÜM / BIST SINAİ / BIST METAL EŞYA, MAKİNA / BIST İSTANBUL / BIST 500 / BIST TÜM-100",İMALAT / METAL EŞYA MAKİNE ELEKTRİKLİ CİHAZLAR VE ULAŞIM ARAÇLARI,YILDIZ PAZAR
"PBT, PBTR",PASHA YATIRIM BANKASI A.Ş.,İSTANBUL,KPMG BAĞIMSIZ DENETİM VE SERBEST MUHASEBECİ MALİ MÜŞAVİRLİK A.Ş.,https://www.kap.org.tr/tr/sirket-bilgileri/ozet/2025-pasha-yatirim-bankasi-a-s,"PASHA Plaza, Sultan Selim Mahallesi, Hümeyra Sokak, No:2/7, 34415, Kağıthane, İstanbul",info@pashabank.com.tr,www.pashabank.com.tr,Süresiz,KPMG BAĞIMSIZ DENETİM VE SERBEST MUHASEBECİ MALİ MÜŞAVİRLİK A.Ş.,,,KESİN ALIM SATIM PAZARI-(NİTELİKLİ YATIRIMCILAR ARASINDA)
PASEU,PASİFİK EURASİA LOJİSTİK DIŞ TİCARET A.Ş.,ANKARA,DENEYİM BAĞIMSIZ DENETİM VE DANIŞMANLIK A.Ş.,https://www.kap.org.tr/tr/sirket-bilgileri/ozet/5826-pasifik-eurasia-lojistik-dis-ticaret-a-s,Kızılırmak Mah. Dumlupınar Bulvarı (Eskişehir Yolu) No: 3 Next Level A Blok 1. Kat No: 1 06530 Söğütözü Çankaya / ANKARA,info@pasifikeurasia.com.tr,www.pasifikeurasia.com.tr,sınırsız,DENEYİM BAĞIMSIZ DENETİM VE DANIŞMANLIK A.Ş.,BIST 500 / BIST KATILIM 100 / BIST KATILIM TUM / BIST TÜM / BIST ANKARA / BIST HİZMETLER / BIST ULAŞTIRMA / BIST HALKA ARZ / BIST TÜM-100 / BIST YILDIZ,ULAŞTIRMA VE DEPOLAMA / ULAŞTIRMA VE DEPOLAMA,YILDIZ PAZAR
PSGYO,PASİFİK GAYRİMENKUL YATIRIM ORTAKLIĞI A.Ş.,ANKARA,DENEYİM BAĞIMSIZ DENETİM VE DANIŞMANLIK A.Ş.,https://www.kap.org.tr/tr/sirket-bilgileri/ozet/5371-pasifik-gayrimenkul-yatirim-ortakligi-a-s,KIZILIRMAK MAH.DUMLUPINAR BULV NEXT LEVEL A BLOK NO.3A KAT:1 ÇANKAYA ANKARA,info@pasifikgyo.com.tr,https://www.pasifikgyo.com.tr/,SÜRESİZ,DENEYİM BAĞIMSIZ DENETİM VE DANIŞMANLIK A.Ş.,BIST TÜM-100 / BIST GERİ ALIM / BIST GAYRİMENKUL YAT. ORT. / BIST TÜM / BIST YILDIZ / BIST 500 / BIST MALİ,MALİ KURULUŞLAR / GAYRİMENKUL YATIRIM ORTAKLIKLARI,YILDIZ PAZAR
PATEK,PASİFİK TEKNOLOJİ A.Ş.,İSTANBUL,DENEYİM BAĞIMSIZ DENETİM VE DANIŞMANLIK A.Ş.,https://www.kap.org.tr/tr/sirket-bilgileri/ozet/5928-pasifik-teknoloji-a-s,Ayazağa Mahallesi Kemerburgaz Caddesi Vadi İstanbul Park Sitesi  7A Blok No:7B İç Kapı No:32 SARIYER /İSTANBUL,info@pasifikteknoloji.com,www.pasifikteknoloji.com,süresiz,DENEYİM BAĞIMSIZ DENETİM VE DANIŞMANLIK A.Ş.,BIST TEKNOLOJİ / BIST İSTANBUL / BIST YILDIZ / BIST KATILIM TUM / BIST TÜM / BIST HALKA ARZ / BIST TÜM-100 / BIST KATILIM 100 / BIST BİLİŞİM / BIST 500,TEKNOLOJİ / BİLİŞİM,YILDIZ PAZAR
PCILT,PC İLETİŞİM VE MEDYA HİZMETLERİ SANAYİ TİCARET A.Ş.,İSTANBUL,VİZYON GRUP BAĞIMSIZ DENETİM.A.Ş.,https://www.kap.org.tr/tr/sirket-bilgileri/ozet/5299-pc-iletisim-ve-medya-hizmetleri-sanayi-ticaret-a-s,"Barbaros Bulvarı, Morbasan Sokak, Koza İş Merkezi, C Blok, No: 14 K: 9-10 Balmumcu/Beşiktaş/Türkiye",yatirimci.iliskileri@pciletisimmedya.com,https://www.pciletisimmedya.com/,Şirket süresiz olarak kurulmuştur,VİZYON GRUP BAĞIMSIZ DENETİM.A.Ş.,BIST TÜM / BIST ANA / BIST HİZMETLER / BIST 500 / BIST TÜM-100 / BIST İSTANBUL / BIST TEMETTÜ,"MESLEKİ, BİLİMSEL VE TEKNİK FAALİYETLER / REKLAMCILIK VE PAZAR ARAŞTIRMASI",ANA PAZAR
PGSUS,PEGASUS HAVA TAŞIMACILIĞI A.Ş.,İSTANBUL,GÜNEY BAĞIMSIZ DENETİM VE SERBEST MUHASEBECİ MALİ MÜŞAVİRLİK A.Ş.,https://www.kap.org.tr/tr/sirket-bilgileri/ozet/1710-pegasus-hava-tasimaciligi-a-s,"Aeropark, Yenişehir Mahallesi, Osmanlı Bulvarı, No: 11/A
Kurtköy 34912 Pendik / İstanbul",ir@flypgs.com --- PEGASUSYATIRIMCIILISKILERI@flypgs.com,Kurumsal İnternet Sitesi: www.flypgs.com / Yatırımcı İlişkileri İnternet Sitesi: http://www.pegasusyatirimciiliskileri.com/tr/default.aspx,Şirket Ana Sözleşmesinin 5. maddesi uyarınca Şirketin süresi sınırsızdır.,GÜNEY BAĞIMSIZ DENETİM VE SERBEST MUHASEBECİ MALİ MÜŞAVİRLİK A.Ş.,BIST SÜRDÜRÜLEBİLİRLİK KATILIM / BIST TÜM / BIST İSTANBUL / BIST 100 / BIST KATILIM 100 / BIST YILDIZ / BIST 50 / BIST BANKA DIŞI LİKİT 10 / BIST SÜRDÜRÜLEBİLİRLİK 25 / BIST KATILIM TUM / BIST KURUMSAL YÖNETİM / BIST HİZMETLER / BIST SÜRDÜRÜLEBİLİRLİK / BIST KATILIM 30 / BIST ULAŞTIRMA / BIST 500 / BIST KATILIM 50 / BIST 30,ULAŞTIRMA VE DEPOLAMA / ULAŞTIRMA VE DEPOLAMA,YILDIZ PAZAR
PEKGY,PEKER GAYRİMENKUL YATIRIM ORTAKLIĞI A.Ş.,İSTANBUL,VİZYON GRUP BAĞIMSIZ DENETİM.A.Ş.,https://www.kap.org.tr/tr/sirket-bilgileri/ozet/4584-peker-gayrimenkul-yatirim-ortakligi-a-s,Cumhuriyet Mah. Silahşör Cad. Yeniyol Sk. No:8 / 2-3 Şişli İstanbul,info@pekergyo.com,www.pekergyo.com,Süresiz,VİZYON GRUP BAĞIMSIZ DENETİM.A.Ş.,BIST KATILIM TUM / BIST 500 / BIST YILDIZ / BIST 100-30 / BIST TÜM / BIST KATILIM 50 / BIST 100 / BIST GAYRİMENKUL YAT. ORT. / BIST KATILIM 100 / BIST MALİ,MALİ KURULUŞLAR / GAYRİMENKUL YATIRIM ORTAKLIKLARI,KESİN ALIM SATIM PAZARI-(NİTELİKLİ YATIRIMCILAR ARASINDA) / YILDIZ PAZAR
PENGD,PENGUEN GIDA SANAYİ A.Ş.,BURSA,EREN BAĞIMSIZ DENETİM A.Ş.,https://www.kap.org.tr/tr/sirket-bilgileri/ozet/1052-penguen-gida-sanayi-a-s,Balkan Mah.Mümin Gençoğlu Cad.No:1 16240 Nilüfer / Bursa / Türkiye,penguen@penguen.com.tr,www.penguen.com.tr,süresiz,EREN BAĞIMSIZ DENETİM A.Ş.,"BIST TÜM / BIST KATILIM TUM / BIST ANA / BIST SINAİ / BIST BURSA / BIST TÜM-100 / BIST GIDA, İÇECEK / BIST 500","İMALAT / GIDA, İÇECEK VE TÜTÜN",ANA PAZAR
PENTA,PENTA TEKNOLOJİ ÜRÜNLERİ DAĞITIM TİCARET A.Ş.,İSTANBUL,PwC BAĞIMSIZ DENETİM VE SERBEST MUHASEBECİ MALİ MÜŞAVİRLİK A.Ş,https://www.kap.org.tr/tr/sirket-bilgileri/ozet/3909-penta-teknoloji-urunleri-dagitim-ticaret-a-s,"Organize Sanayi Bölgesi, 4. Cadde No:1 34775 Yukarı Dudullu, Ümraniye/İstanbul",yatirimciiliskileri@penta.com.tr,www.penta.com.tr,Süresiz,PwC BAĞIMSIZ DENETİM VE SERBEST MUHASEBECİ MALİ MÜŞAVİRLİK A.Ş,BIST YILDIZ / BIST KATILIM TUM / BIST 500 / BIST TÜM / BIST KATILIM 100 / BIST BİLİŞİM / BIST TÜM-100 / BIST TEKNOLOJİ / BIST İSTANBUL,TEKNOLOJİ / BİLİŞİM,YILDIZ PAZAR
PEHOL,PERA YATIRIM HOLDİNG A.Ş.,ANKARA,KARAR BAĞIMSIZ DENETİM VE DANIŞMANLIK A.Ş.,https://www.kap.org.tr/tr/sirket-bilgileri/ozet/968-pera-yatirim-holding-a-s,Kızılırmak Mah. Dumlupınar Bulvarı 3-B İç Kapı no:77 Next Level Plaza Çankaya Ankara,info@peraholding.com.tr,www.peraholding.com.tr,Süresiz,KARAR BAĞIMSIZ DENETİM VE DANIŞMANLIK A.Ş.,BIST YILDIZ / BIST 500 / BIST MALİ / BIST HOLDİNG VE YATIRIM / BIST TÜM / BIST ANKARA / BIST TÜM-100,MALİ KURULUŞLAR / HOLDİNGLER VE YATIRIM ŞİRKETLERİ,YILDIZ PAZAR
PSDTC,PERGAMON STATUS DIŞ TİCARET A.Ş.,İZMİR,ANIL YEMİNLİ MALİ MÜŞAVİRLİK VE BAĞIMSIZ DENETİM A.Ş.,https://www.kap.org.tr/tr/sirket-bilgileri/ozet/2371-pergamon-status-dis-ticaret-a-s,Alsancak Mahallesi 1456 Sokak BAROHAN No:16 İç Kapı No:11  35220 Konak / İZMİR,info@psdisticaret.com.tr,www.psdisticaret.com.tr,Süresiz,ANIL YEMİNLİ MALİ MÜŞAVİRLİK VE BAĞIMSIZ DENETİM A.Ş.,BIST ANA / BIST 500 / BIST TÜM-100 / BIST TİCARET / BIST HİZMETLER / BIST TÜM / BIST İZMİR,TOPTAN VE PERAKENDE TİCARET / TOPTAN TİCARET,ANA PAZAR
PETKM,PETKİM PETROKİMYA HOLDİNG A.Ş.,İZMİR,GÜNEY BAĞIMSIZ DENETİM VE SERBEST MUHASEBECİ MALİ MÜŞAVİRLİK A.Ş.,https://www.kap.org.tr/tr/sirket-bilgileri/ozet/1053-petkim-petrokimya-holding-a-s,SİTELER MAH. NECMETTİN GİRİTLİOĞLU CADDESİ . SOCAR TÜRKİYE ALİAĞA YÖNETİM BİNASI No:6/1 ALİAĞA-İZMİR,petkim@petkim.com.tr,www.petkim.com.tr,SÜRESİZ,GÜNEY BAĞIMSIZ DENETİM VE SERBEST MUHASEBECİ MALİ MÜŞAVİRLİK A.Ş.,"BIST SÜRDÜRÜLEBİLİRLİK 25 / BIST SINAİ / BIST 50 / BIST 30 / BIST SÜRDÜRÜLEBİLİRLİK KATILIM / BIST KATILIM 30 / BIST SÜRDÜRÜLEBİLİRLİK / BIST YILDIZ / BIST KATILIM 50 / BIST 100 / BIST TÜM / BIST 500 / BIST KATILIM 100 / BIST KİMYA, PETROL, PLASTİK / BIST İZMİR / BIST KATILIM TUM",İMALAT / KİMYA İLAÇ PETROL LASTİK VE PLASTİK ÜRÜNLER,YILDIZ PAZAR
PKENT,PETROKENT TURİZM A.Ş.,ANKARA,C&Ç BAĞIMSIZ DENETİM VE YÖNETİM DANIŞMANLIĞI A.Ş.,https://www.kap.org.tr/tr/sirket-bilgileri/ozet/1054-petrokent-turizm-a-s,BARBAROS MAHALLESİ BİLLUR SOKAK NO.1/2 ÇANKAYA/ANKARA,info@petrokent.com.tr,www.petrokent.com.tr,"Şirketin süresi, sınırsızdır. Bu süre şirket sözleşmesini değiştirmek suretiyle kısaltılabilir.",C&Ç BAĞIMSIZ DENETİM VE YÖNETİM DANIŞMANLIĞI A.Ş.,BIST ANA / BIST TURİZM / BIST TÜM-100 / BIST HİZMETLER / BIST ANTALYA / BIST TÜM / BIST 500,OTELLER VE LOKANTALAR / KONAKLAMA,ANA PAZAR
PETUN,PINAR ENTEGRE ET VE UN SANAYİİ A.Ş.,İZMİR,KPMG BAĞIMSIZ DENETİM VE SERBEST MUHASEBECİ MALİ MÜŞAVİRLİK A.Ş.,https://www.kap.org.tr/tr/sirket-bilgileri/ozet/1057-pinar-entegre-et-ve-un-sanayii-a-s,Kemalpaşa Osb Mahallesi 503 Sk. No:224 Kemalpaşa - İZMİR,info@pinaret.com.tr,www.pinar.com.tr,Süresiz,KPMG BAĞIMSIZ DENETİM VE SERBEST MUHASEBECİ MALİ MÜŞAVİRLİK A.Ş.,"BIST İZMİR / BIST KURUMSAL YÖNETİM / BIST SINAİ / BIST YILDIZ / BIST TEMETTÜ / BIST GIDA, İÇECEK / BIST 500 / BIST TÜM-100 / BIST TÜM / BIST KATILIM TEMETTU / BIST KATILIM TUM","İMALAT / GIDA, İÇECEK VE TÜTÜN",YILDIZ PAZAR / KESİN ALIM SATIM PAZARI-(NİTELİKLİ YATIRIMCILAR ARASINDA)
PINSU,PINAR SU VE İÇECEK SANAYİ VE TİCARET A.Ş.,İZMİR,KPMG BAĞIMSIZ DENETİM VE SERBEST MUHASEBECİ MALİ MÜŞAVİRLİK A.Ş.,https://www.kap.org.tr/tr/sirket-bilgileri/ozet/1058-pinar-su-ve-icecek-sanayi-ve-ticaret-a-s,KEMALPAŞA Mah. KEMALPAŞA Cad.No.262 BORNOVA/ İZMİR,info@pinarsu.com.tr,www.pinarsu.com.tr,Süresiz,KPMG BAĞIMSIZ DENETİM VE SERBEST MUHASEBECİ MALİ MÜŞAVİRLİK A.Ş.,"BIST 500 / BIST SINAİ / BIST GIDA, İÇECEK / BIST İZMİR / BIST ANA / BIST TÜM / BIST KURUMSAL YÖNETİM / BIST TÜM-100","İMALAT / GIDA, İÇECEK VE TÜTÜN",ANA PAZAR
PNSUT,PINAR SÜT MAMÜLLERİ SANAYİİ A.Ş.,İZMİR,KPMG BAĞIMSIZ DENETİM VE SERBEST MUHASEBECİ MALİ MÜŞAVİRLİK A.Ş.,https://www.kap.org.tr/tr/sirket-bilgileri/ozet/1059-pinar-sut-mamulleri-sanayii-a-s,Yunus Emre Mah. Kemalpaşa Cad. No:317 BORNOVA/ İZMİR,info@pinar.com.tr,www.pinar.com.tr,Süresiz,KPMG BAĞIMSIZ DENETİM VE SERBEST MUHASEBECİ MALİ MÜŞAVİRLİK A.Ş.,"BIST KATILIM TUM / BIST TÜM / BIST SINAİ / BIST İZMİR / BIST GIDA, İÇECEK / BIST KURUMSAL YÖNETİM / BIST YILDIZ / BIST TÜM-100 / BIST 500","İMALAT / GIDA, İÇECEK VE TÜTÜN",YILDIZ PAZAR / KESİN ALIM SATIM PAZARI-(NİTELİKLİ YATIRIMCILAR ARASINDA)
PKART,PLASTİKKART AKILLI KART İLETİŞİM SİSTEMLERİ SANAYİ VE TİCARET A.Ş.,İSTANBUL,BDO DENET BAĞIMSIZ DENETİM VE DANIŞMANLIK A.Ş.,https://www.kap.org.tr/tr/sirket-bilgileri/ozet/1402-plastikkart-akilli-kart-iletisim-sistemleri-sanayi-ve-ticaret-a-s,"Mimar Sinan Mahallesi, Trablusgarp Bulvarı Blok No:5 Silivri / İstanbul",info@plastkart.com.tr,www.plastkart.com.tr,Süresiz,BDO DENET BAĞIMSIZ DENETİM VE DANIŞMANLIK A.Ş.,BIST İSTANBUL / BIST TÜM / BIST TEKNOLOJİ / BIST ANA / BIST TÜM-100 / BIST KATILIM TUM / BIST 500 / BIST BİLİŞİM,TEKNOLOJİ / BİLİŞİM,ANA PAZAR
PLTUR,PLATFORM TURİZM TAŞIMACILIK GIDA İNŞAAT TEMİZLİK HİZMETLERİ SANAYİ VE TİCARET A.Ş.,İSTANBUL,VİZYON GRUP BAĞIMSIZ DENETİM.A.Ş.,https://www.kap.org.tr/tr/sirket-bilgileri/ozet/3208-platform-turizm-tasimacilik-gida-insaat-temizlik-hizmetleri-sanayi-ve-ticaret-a-s,PLATFORM TURİZM TAŞIMACILIK GIDA İNŞAAT TEMİZLİK HİZMETLERİ SANAYİ VE TİCARET A.Ş.,yatirimciiliskileri@platformturizm.com,www.platformturizm.com,Süresiz,VİZYON GRUP BAĞIMSIZ DENETİM.A.Ş.,BIST HİZMETLER / BIST ANA / BIST HALKA ARZ / BIST 500 / BIST TÜM-100 / BIST TÜM / BIST İSTANBUL / BIST KATILIM TUM,İDARİ VE DESTEK HİZMET FAALİYETLERİ / KİRALAMA VE LEASING FAALİYETLERİ,ANA PAZAR
POLHO,POLİSAN HOLDİNG A.Ş.,KOCAELİ,PwC BAĞIMSIZ DENETİM VE SERBEST MUHASEBECİ MALİ MÜŞAVİRLİK A.Ş,https://www.kap.org.tr/tr/sirket-bilgileri/ozet/1608-polisan-holding-a-s,Dilovası Organize Sanayi Bölgesi 1. Kısım Liman Caddesi No:7 Dilovası-KOCAELİ,yatirimciiliskileri@polisanholding.com.tr  --- investorrelations@polisanholding.com.tr,www.polisanholding.com.tr,"Şirketin müddeti sınırsızdır. Şirket Türk Ticaret Kanunu'nun ilgili hükümleri ile infisah eder ve fesih edilir. Şirketin feshi ve infisah etmesi durumunda yapılacak muameleler Türk Ticaret Kanunu, Sermaye Piyasası Kanunu ve diğer ilgili mevzuat hükümleri çerçevesinde yürütülür.",PwC BAĞIMSIZ DENETİM VE SERBEST MUHASEBECİ MALİ MÜŞAVİRLİK A.Ş,BIST SÜRDÜRÜLEBİLİRLİK / BIST KATILIM TEMETTU / BIST SÜRDÜRÜLEBİLİRLİK KATILIM / BIST TEMETTÜ / BIST TÜM / BIST KATILIM 100 / BIST YILDIZ / BIST HOLDİNG VE YATIRIM / BIST TÜM-100 / BIST KOCAELİ / BIST 500 / BIST KATILIM TUM / BIST MALİ,MALİ KURULUŞLAR / HOLDİNGLER VE YATIRIM ŞİRKETLERİ,YILDIZ PAZAR
POLTK,POLİTEKNİK METAL SANAYİ VE TİCARET A.Ş.,İSTANBUL,DENGE BAĞIMSIZ DENETİM SERBEST MUHASEBECİ MALİ MÜŞAVİRLİK A.Ş.,https://www.kap.org.tr/tr/sirket-bilgileri/ozet/2219-politeknik-metal-sanayi-ve-ticaret-a-s,Tuzla Kimyacılar Org. San. Böl. Melek Aras Bulvarı Kristal Cad. No:2 B-1 / B-4 Parsel Tuzla/İSTANBUL,yatirimciiliskileri@pm.com.tr,www.pm.com.tr,SÜRESİZ,DENGE BAĞIMSIZ DENETİM SERBEST MUHASEBECİ MALİ MÜŞAVİRLİK A.Ş.,"BIST KİMYA, PETROL, PLASTİK / BIST YILDIZ / BIST İSTANBUL / BIST 500 / BIST TÜM / BIST SINAİ / BIST TÜM-100 / BIST KOBI SANAYİ",İMALAT / KİMYA İLAÇ PETROL LASTİK VE PLASTİK ÜRÜNLER,YILDIZ PAZAR
PRZMA,PRİZMA PRES MATBAACILIK YAYINCILIK SANAYİ VE TİCARET A.Ş.,İSTANBUL,GRC BAĞIMSIZ DENETİM A.Ş.,https://www.kap.org.tr/tr/sirket-bilgileri/ozet/1599-prizma-pres-matbaacilik-yayincilik-sanayi-ve-ticaret-a-s,Atatürk Organize Sanayi Bölgesi 75. Yıl Cad. No:21 Hadımköy-Arnavutköy/İSTANBUL,info@prizmapress.com.tr,www.prizmapress.com.tr,Süresiz,GRC BAĞIMSIZ DENETİM A.Ş.,"BIST TÜM / BIST 500 / BIST İSTANBUL / BIST ORMAN, KAĞIT, BASIM / BIST KOBI SANAYİ / BIST ANA / BIST TÜM-100 / BIST SINAİ",İMALAT / KAĞIT VE KAĞIT ÜRÜNLERİ BASIM,ANA PAZAR
QYHOL,Q YATIRIM HOLDİNG A.Ş.,AYDIN,NEVADOS BAĞIMSIZ DENETİM A.Ş.,https://www.kap.org.tr/tr/sirket-bilgileri/ozet/5667-q-yatirim-holding-a-s,Söke OSB Mahallesi 4. Sokak 1/2/3 Blok No:1 İç Kapı No:1 Söke/ AYDIN,info@qyatirim.com.tr,www.qyatirim.com.tr,Süresiz,NEVADOS BAĞIMSIZ DENETİM A.Ş.,,,KESİN ALIM SATIM PAZARI-(NİTELİKLİ YATIRIMCILAR ARASINDA)
QNBFF,QNB FİNANS FAKTORİNG A.Ş.,İSTANBUL,PwC BAĞIMSIZ DENETİM VE SERBEST MUHASEBECİ MALİ MÜŞAVİRLİK A.Ş,https://www.kap.org.tr/tr/sirket-bilgileri/ozet/2218-qnb-finans-faktoring-a-s,Esentepe Mah.Büyükdere Cad.Kristal Kule Kat.21 No:215 34330 Şişli İSTANBUL,info@qnbff.com,www.qnbff.com,Süresiz,PwC BAĞIMSIZ DENETİM VE SERBEST MUHASEBECİ MALİ MÜŞAVİRLİK A.Ş,,,KESİN ALIM SATIM PAZARI-(NİTELİKLİ YATIRIMCILAR ARASINDA)
QNBFL,QNB FİNANS FİNANSAL KİRALAMA A.Ş.,İSTANBUL,PwC BAĞIMSIZ DENETİM VE SERBEST MUHASEBECİ MALİ MÜŞAVİRLİK A.Ş,https://www.kap.org.tr/tr/sirket-bilgileri/ozet/953-qnb-finans-finansal-kiralama-a-s,"ESENTEPE MAH. BÜYÜKDERE CAD. KRİSTAL KULE BİNASI NO:215 KAT:22 34394, ŞİŞLİ, İSTANBUL",info@qnbfl.com,www.qnbfl.com,Süresiz,PwC BAĞIMSIZ DENETİM VE SERBEST MUHASEBECİ MALİ MÜŞAVİRLİK A.Ş,BIST TÜM-100 / BIST TÜM,MALİ KURULUŞLAR / FİNANSAL KİRALAMA VE FAKTORİNG ŞİRKETLERİ,KESİN ALIM SATIM PAZARI-(NİTELİKLİ YATIRIMCILAR ARASINDA) / PİYASA ÖNCESİ İŞLEM PLATFORMU
QNBVK,QNB FİNANS VARLIK KİRALAMA A.Ş.,İSTANBUL,PwC BAĞIMSIZ DENETİM VE SERBEST MUHASEBECİ MALİ MÜŞAVİRLİK A.Ş,https://www.kap.org.tr/tr/sirket-bilgileri/ozet/4843-qnb-finans-varlik-kiralama-a-s,ESENTEPE MAHALLESİ BÜYÜKDERE CAD. NO:215/1 ŞİŞLİ/İSTANBUL,info@qnbfv.com,http://www.qnbfv.com/,,PwC BAĞIMSIZ DENETİM VE SERBEST MUHASEBECİ MALİ MÜŞAVİRLİK A.Ş,,,KESİN ALIM SATIM PAZARI-(NİTELİKLİ YATIRIMCILAR ARASINDA)
"FNY, QNBFI",QNB FİNANS YATIRIM MENKUL DEĞERLER A.Ş.,İSTANBUL,PwC BAĞIMSIZ DENETİM VE SERBEST MUHASEBECİ MALİ MÜŞAVİRLİK A.Ş,https://www.kap.org.tr/tr/sirket-bilgileri/ozet/1302-qnb-finans-yatirim-menkul-degerler-a-s,Esentepe Mah. Büyükdere Cad. Kristal Kule Binası No:215 Kat 6/7   34394 Şişli/İstanbul,fny@qnbfi.com,www.qnbfi.com,Faaliyette,PwC BAĞIMSIZ DENETİM VE SERBEST MUHASEBECİ MALİ MÜŞAVİRLİK A.Ş,,,KESİN ALIM SATIM PAZARI-(NİTELİKLİ YATIRIMCILAR ARASINDA)
"FIN, QNBFB",QNB FİNANSBANK A.Ş.,İSTANBUL,PwC BAĞIMSIZ DENETİM VE SERBEST MUHASEBECİ MALİ MÜŞAVİRLİK A.Ş,https://www.kap.org.tr/tr/sirket-bilgileri/ozet/2417-qnb-finansbank-a-s,Esentepe Mahallesi Büyükdere Caddesi Kristal Kule Binası No: 215 Şişli İstanbul,qnbfinansbank@hs05.kep.tr,www.qnbfinansbank.com,Süresiz,PwC BAĞIMSIZ DENETİM VE SERBEST MUHASEBECİ MALİ MÜŞAVİRLİK A.Ş,BIST TÜM-100 / BIST TÜM,MALİ KURULUŞLAR / BANKALAR,KESİN ALIM SATIM PAZARI-(NİTELİKLİ YATIRIMCILAR ARASINDA) / PİYASA ÖNCESİ İŞLEM PLATFORMU
QUAGR,QUA GRANITE HAYAL YAPI VE ÜRÜNLERİ SANAYİ TİCARET A.Ş.,AYDIN,NEVADOS BAĞIMSIZ DENETİM A.Ş.,https://www.kap.org.tr/tr/sirket-bilgileri/ozet/4887-qua-granite-hayal-yapi-ve-urunleri-sanayi-ticaret-a-s,Cumhuriyet Mahallesi 1955 Sk. No: 1/11 Efeler/Aydın,yatirimciiliskileri@qua.com.tr --- info@qua.com.tr,www.qua.com.tr,Süresiz,NEVADOS BAĞIMSIZ DENETİM A.Ş.,"BIST TAŞ, TOPRAK / BIST KATILIM TUM / BIST YILDIZ / BIST SINAİ / BIST KATILIM 100 / BIST 100 / BIST 500 / BIST 100-30 / BIST AYDIN / BIST KURUMSAL YÖNETİM / BIST KATILIM 50 / BIST TÜM / BIST SÜRDÜRÜLEBİLİRLİK KATILIM / BIST SÜRDÜRÜLEBİLİRLİK",İMALAT / TAŞ VE TOPRAĞA DAYALI,YILDIZ PAZAR / KESİN ALIM SATIM PAZARI-(NİTELİKLİ YATIRIMCILAR ARASINDA)
QUFIN,QUICK FİNANSMAN A.Ş.,İSTANBUL,GÜRELİ YEMİNLİ MALİ MÜŞAVİRLİK VE BAĞIMSIZ DENETİM HİZMETLERİ A.Ş.,https://www.kap.org.tr/tr/sirket-bilgileri/ozet/5613-quick-finansman-a-s,İçerenköy Mah. Umut Sok. Quick Tower Sit. No:10-12 İç Kapı No:4 Ataşehir/İstanbul,info@quickfinans.com.tr,www.quickfinans.com.tr,Süresiz,GÜRELİ YEMİNLİ MALİ MÜŞAVİRLİK VE BAĞIMSIZ DENETİM HİZMETLERİ A.Ş.,,,KESİN ALIM SATIM PAZARI-(NİTELİKLİ YATIRIMCILAR ARASINDA)
RNPOL,RAİNBOW POLİKARBONAT SANAYİ TİCARET A.Ş.,KAYSERİ,NOTE OFFİCE ULUSLARARASI BAĞIMSIZ DENETİM DANIŞMANLIK VE YEMİNLİ MALİ MÜŞAVİRLİK A.Ş.,https://www.kap.org.tr/tr/sirket-bilgileri/ozet/5418-rainbow-polikarbonat-sanayi-ticaret-a-s,KAYSERİ ORGANİZE SANAYİ MAHALLESİ 20. CADDE NO:33 MELİKGAZİ/KAYSERİ,info@rainbowpc.com.tr,http://www.rainbowpc.com.tr,SÜRESİZ,NOTE OFFİCE ULUSLARARASI BAĞIMSIZ DENETİM DANIŞMANLIK VE YEMİNLİ MALİ MÜŞAVİRLİK A.Ş.,"BIST KAYSERİ / BIST ANA / BIST SINAİ / BIST 500 / BIST TÜM / BIST TÜM-100 / BIST GERİ ALIM / BIST KİMYA, PETROL, PLASTİK",İMALAT / KİMYA İLAÇ PETROL LASTİK VE PLASTİK ÜRÜNLER,ANA PAZAR
RALYH,RAL YATIRIM HOLDİNG A.Ş.,ANKARA,ANY PARTNERS BAĞIMSIZ DENETİM A.Ş.,https://www.kap.org.tr/tr/sirket-bilgileri/ozet/883-ral-yatirim-holding-a-s,Varlık Mahallesi Yakacık Sokak No: 11/1 Yenimahalle/ANKARA,info@ralyatirim.com --- yatirimci.iliskileri@ralyatirim.com,www.ralyatirim.com,SÜRESİZ,ANY PARTNERS BAĞIMSIZ DENETİM A.Ş.,BIST HOLDİNG VE YATIRIM / BIST TÜM / BIST TÜM-100 / BIST KATILIM TUM / BIST ANKARA / BIST GERİ ALIM / BIST YILDIZ / BIST 500 / BIST MALİ,MALİ KURULUŞLAR / HOLDİNGLER VE YATIRIM ŞİRKETLERİ,YILDIZ PAZAR / KESİN ALIM SATIM PAZARI-(NİTELİKLİ YATIRIMCILAR ARASINDA)
