Kod,Unvan,City,BagimsizDenetim,Url,centerAddress,electronicEmailAddress,internet,companyTime,bagimsizDenetimKurulusu,dahilOlduguEndeksler,Sektor,islemGorduguPazarlar
KATVK,KATILIM VARLIK KİRALAMA A.Ş.,İSTANBUL,DRT BAĞIMSIZ DENETİM VE SERBEST MUHASEBECİ MALİ MÜŞAVİRLİK A.Ş.,https://www.kap.org.tr/tr/sirket-bilgileri/ozet/4330-katilim-varlik-kiralama-a-s,İnkılap Mahallesi Dr. Adnan Büyükdeniz Caddesi B Blok No:10 34768 Ümraniye/İstanbul,katilim.vks@vakifkatilim.com.tr,http://www.katilimvarlikkiralama.com.tr/,Şirketin süresi sınırsız olarak belirlenmiştir.,DRT BAĞIMSIZ DENETİM VE SERBEST MUHASEBECİ MALİ MÜŞAVİRLİK A.Ş.,,,KESİN ALIM SATIM PAZARI-(NİTELİKLİ YATIRIMCILAR ARASINDA)
KTLEV,KATILIMEVİM TASARRUF FİNANSMAN A.Ş.,İSTANBUL,AKSİS ULUSLARARASI BAĞIMSIZ DENETİM A.Ş.,https://www.kap.org.tr/tr/sirket-bilgileri/ozet/5763-katilimevim-tasarruf-finansman-a-s,Şerifali Mah. Kale Sok. No: 21-23/1 Ümraniye/İstanbul,yatirimci.iliskileri@katilimevim.com.tr,www.katilimevim.com.tr,Süresiz,AKSİS ULUSLARARASI BAĞIMSIZ DENETİM A.Ş.,BIST 500 / BIST KATILIM 100 / BIST HALKA ARZ / BIST YILDIZ / BIST KATILIM TUM / BIST TÜM / BIST KATILIM 50 / BIST 100-30 / BIST MALİ / BIST KATILIM 30 / BIST 100,MALİ KURULUŞLAR / FİNANSMAN ŞİRKETLERİ,YILDIZ PAZAR
KATMR,KATMERCİLER ARAÇ ÜSTÜ EKİPMAN SANAYİ VE TİCARET A.Ş.,İZMİR,AKSİS ULUSLARARASI BAĞIMSIZ DENETİM A.Ş.,https://www.kap.org.tr/tr/sirket-bilgileri/ozet/1528-katmerciler-arac-ustu-ekipman-sanayi-ve-ticaret-a-s,10032  Sokak NO:10 Atatürk Organize Sanayi Bölgesi Çiğli / İzmir,yatirimciiliskileri@katmerciler.com.tr,www.katmerciler.com.tr,Süresiz,AKSİS ULUSLARARASI BAĞIMSIZ DENETİM A.Ş.,"BIST KATILIM 100 / BIST TÜM-100 / BIST İZMİR / BIST 500 / BIST KATILIM TUM / BIST TÜM / BIST METAL EŞYA, MAKİNA / BIST SINAİ / BIST YILDIZ",İMALAT / METAL EŞYA MAKİNE ELEKTRİKLİ CİHAZLAR VE ULAŞIM ARAÇLARI,YILDIZ PAZAR
KAYSE,KAYSERİ ŞEKER FABRİKASI A.Ş.,KAYSERİ,KPMG BAĞIMSIZ DENETİM VE SERBEST MUHASEBECİ MALİ MÜŞAVİRLİK A.Ş.,https://www.kap.org.tr/tr/sirket-bilgileri/ozet/3723-kayseri-seker-fabrikasi-a-s,"Şeker Mahallesi Osman Kavuncu Bulvarı No:314
Kocasinan / KAYSERİ",yatirimci.iliskileri@kayseriseker.com.tr,https://www.kayseriseker.com.tr/,Şirket süresiz olarak kurulmuştur,KPMG BAĞIMSIZ DENETİM VE SERBEST MUHASEBECİ MALİ MÜŞAVİRLİK A.Ş.,"BIST SINAİ / BIST TÜM / BIST KATILIM 50 / BIST YILDIZ / BIST 100 / BIST KATILIM TUM / BIST KATILIM 100 / BIST 100-30 / BIST HALKA ARZ / BIST GIDA, İÇECEK / BIST 500 / BIST KAYSERİ","İMALAT / GIDA, İÇECEK VE TÜTÜN",YILDIZ PAZAR
KNTFA,KENT FİNANS FAKTORİNG A.Ş.,İSTANBUL,EREN BAĞIMSIZ DENETİM A.Ş.,https://www.kap.org.tr/tr/sirket-bilgileri/ozet/2114-kent-finans-faktoring-a-s,ASKEROCAĞI CAD.SÜZER PLAZA NO:6 KAT:4 A ŞİŞLİ/İSTANBUL,info@kentfinans.com.tr,www.kentfinans.com.tr,Süresiz,EREN BAĞIMSIZ DENETİM A.Ş.,,,KESİN ALIM SATIM PAZARI-(NİTELİKLİ YATIRIMCILAR ARASINDA)
KENT,KENT GIDA MADDELERİ SANAYİİ VE TİCARET A.Ş.,KOCAELİ,PwC BAĞIMSIZ DENETİM VE SERBEST MUHASEBECİ MALİ MÜŞAVİRLİK A.Ş,https://www.kap.org.tr/tr/sirket-bilgileri/ozet/1000-kent-gida-maddeleri-sanayii-ve-ticaret-a-s,Cumhuriyet Mah. 2253 Sok. No:11 Gebze 41400 KOCAELİ,Yatirimci.iliskileri@mdlz.com --- Beyhan.Armagan@mdlz.com,www.kentgida.net,Süresiz,PwC BAĞIMSIZ DENETİM VE SERBEST MUHASEBECİ MALİ MÜŞAVİRLİK A.Ş,BIST TÜM-100 / BIST TÜM,"İMALAT / GIDA, İÇECEK VE TÜTÜN",PİYASA ÖNCESİ İŞLEM PLATFORMU
KERVT,KEREVİTAŞ GIDA SANAYİ VE TİCARET A.Ş.,İSTANBUL,PwC BAĞIMSIZ DENETİM VE SERBEST MUHASEBECİ MALİ MÜŞAVİRLİK A.Ş,https://www.kap.org.tr/tr/sirket-bilgileri/ozet/1002-kerevitas-gida-sanayi-ve-ticaret-a-s,Kısıklı Mah.Ferah Cad.Yıldız Holding Placid Bloğu No:1/A Üsküdar İstanbul,yatirimci@kerevitas.com.tr,www.kerevitas.com.tr,99 yıl,PwC BAĞIMSIZ DENETİM VE SERBEST MUHASEBECİ MALİ MÜŞAVİRLİK A.Ş,"BIST GIDA, İÇECEK / BIST TÜM / BIST 500 / BIST BURSA / BIST YILDIZ / BIST SÜRDÜRÜLEBİLİRLİK / BIST SINAİ / BIST TÜM-100","İMALAT / GIDA, İÇECEK VE TÜTÜN",YILDIZ PAZAR
KRVGD,KERVAN GIDA SANAYİ VE TİCARET A.Ş.,İSTANBUL,YEDİTEPE BAĞIMSIZ DENETİM VE YEMİNLİ MALİ MÜŞAVİRLİK A.Ş.,https://www.kap.org.tr/tr/sirket-bilgileri/ozet/3456-kervan-gida-sanayi-ve-ticaret-a-s,Marmara Mahallesi 107. Sokak No: 15 İç Kapı No: 3 BEYLİKDÜZÜ / İSTANBUL,kervangida@kervangida.com --- yatirimci.iliskileri@kervangida.com,www.kervangida.com,Süresiz,YEDİTEPE BAĞIMSIZ DENETİM VE YEMİNLİ MALİ MÜŞAVİRLİK A.Ş.,"BIST 500 / BIST TÜM-100 / BIST KATILIM TEMETTU / BIST KATILIM TUM / BIST TEMETTÜ / BIST GERİ ALIM / BIST GIDA, İÇECEK / BIST SINAİ / BIST TÜM / BIST YILDIZ / BIST İSTANBUL","İMALAT / GIDA, İÇECEK VE TÜTÜN",YILDIZ PAZAR
KERVN,KERVANSARAY YATIRIM HOLDİNG A.Ş.,İSTANBUL,MEGA GLOBAL ULUSLARARASI BAĞIMSIZ DENETİM A.Ş.,https://www.kap.org.tr/tr/sirket-bilgileri/ozet/897-kervansaray-yatirim-holding-a-s,"Ayazağa Mahallesi, Söğüt Sokak, Ağaoğlu Maslak 1453 T2 Blok Daire:2 Sarıyer / İSTANBUL",info@kervansarayhotels.com.tr,www.kervansarayholding.com.tr,Şirket süresiz olarak kurulmuştur. Bu süre Sanayi ve Ticaret Bakanlığından izin almak ve ana sözleşmeyi değiştirmek suretiyle değiştirilebilir.,MEGA GLOBAL ULUSLARARASI BAĞIMSIZ DENETİM A.Ş.,,MALİ KURULUŞLAR / HOLDİNGLER VE YATIRIM ŞİRKETLERİ,YAKIN İZLEME PAZARI
TCKRC,KIRAÇ GALVANİZ TELEKOMİNİKASYON METAL MAKİNE İNŞAAT ELEKTRİK SANAYİ VE TİCARET A.Ş.,BURSA,SER-BERKER BAĞIMSIZ DENETİM A.Ş.,https://www.kap.org.tr/tr/sirket-bilgileri/ozet/6010-kirac-galvaniz-telekominikasyon-metal-makine-insaat-elektrik-sanayi-ve-ticaret-a-s,Barakfakih Mah. Vatan Cad. No:60 Kestel/Bursa,info@tck.com.tr,www.tck.com.tr,Süresiz,SER-BERKER BAĞIMSIZ DENETİM A.Ş.,BIST TÜM-100 / BIST METAL ANA / BIST HALKA ARZ / BIST TÜM / BIST SINAİ / BIST KATILIM TUM / BIST YILDIZ / BIST BURSA,İMALAT / ANA METAL SANAYİ,YILDIZ PAZAR
KZBGY,KIZILBÜK GAYRİMENKUL YATIRIM ORTAKLIĞI A.Ş.,İSTANBUL,ARSEN BAĞIMSIZ DENETİM HİZMETLERİ A.Ş.,https://www.kap.org.tr/tr/sirket-bilgileri/ozet/5395-kizilbuk-gayrimenkul-yatirim-ortakligi-a-s,"Dikilitaş Mahallesi, Yenidoğan Sokak, Sinpaş Plaza, No:36/1-1 Beşiktaş - İstanbul",investorrelations@kizilbukgyo.com,www.kizilbukgyo.com,Şirket'in hukuki varlığı herhangi bir süre ile kısıtlanmamıştır.,ARSEN BAĞIMSIZ DENETİM HİZMETLERİ A.Ş.,BIST YILDIZ / BIST KATILIM 100 / BIST TÜM-100 / BIST 500 / BIST MALİ / BIST TÜM / BIST KATILIM TUM / BIST GAYRİMENKUL YAT. ORT.,MALİ KURULUŞLAR / GAYRİMENKUL YATIRIM ORTAKLIKLARI,YILDIZ PAZAR
KLGYO,KİLER GAYRİMENKUL YATIRIM ORTAKLIĞI A.Ş.,İSTANBUL,EREN BAĞIMSIZ DENETİM A.Ş.,https://www.kap.org.tr/tr/sirket-bilgileri/ozet/1541-kiler-gayrimenkul-yatirim-ortakligi-a-s,Emniyet Evleri Mahallesi Eski Büyükdere Caddesi No.1/1 Kat.7 Kağıthane İstanbul,info@kilergyo.com,www.kilergyo.com,Süresiz,EREN BAĞIMSIZ DENETİM A.Ş.,BIST 500 / BIST GAYRİMENKUL YAT. ORT. / BIST YILDIZ / BIST TÜM / BIST TÜM-100 / BIST MALİ,MALİ KURULUŞLAR / GAYRİMENKUL YATIRIM ORTAKLIKLARI,YILDIZ PAZAR
KLRHO,KİLER HOLDİNG A.Ş.,İSTANBUL,EREN BAĞIMSIZ DENETİM A.Ş.,https://www.kap.org.tr/tr/sirket-bilgileri/ozet/3766-kiler-holding-a-s,Emniyet Evleri Mahallesi Eski Büyükdere Caddesi No.1/1 Kat.7 Kağıthane/İstanbul,info@kiler.com.tr,www.kilerholding.com.tr,Süresiz,EREN BAĞIMSIZ DENETİM A.Ş.,BIST MALİ / BIST HOLDİNG VE YATIRIM / BIST TÜM-100 / BIST YILDIZ / BIST 500 / BIST TÜM / BIST İSTANBUL,MALİ KURULUŞLAR / HOLDİNGLER VE YATIRIM ŞİRKETLERİ,YILDIZ PAZAR
KMPUR,KİMTEKS POLİÜRETAN SANAYİ VE TİCARET A.Ş.,İSTANBUL,DRT BAĞIMSIZ DENETİM VE SERBEST MUHASEBECİ MALİ MÜŞAVİRLİK A.Ş.,https://www.kap.org.tr/tr/sirket-bilgileri/ozet/5480-kimteks-poliuretan-sanayi-ve-ticaret-a-s,İnkilap Mah. Dr. Adnan Büyükdeniz Cad. No:13 İç Kapı No:6 Ümraniye/İstanbul,yatirimciiliskileri@kimpur.com,www.kimpur.com.,Süresiz,DRT BAĞIMSIZ DENETİM VE SERBEST MUHASEBECİ MALİ MÜŞAVİRLİK A.Ş.,"BIST KOCAELİ / BIST TÜM-100 / BIST YILDIZ / BIST KURUMSAL YÖNETİM / BIST KİMYA, PETROL, PLASTİK / BIST TÜM / BIST SÜRDÜRÜLEBİLİRLİK / BIST TEMETTÜ / BIST SINAİ / BIST 500",İMALAT / KİMYA İLAÇ PETROL LASTİK VE PLASTİK ÜRÜNLER,YILDIZ PAZAR
KLMSN,KLİMASAN KLİMA SANAYİ VE TİCARET A.Ş.,MANİSA,BDO DENET BAĞIMSIZ DENETİM VE DANIŞMANLIK A.Ş.,https://www.kap.org.tr/tr/sirket-bilgileri/ozet/1004-klimasan-klima-sanayi-ve-ticaret-a-s,MANİSA OSB 1.KISIM KEÇİLİKÖY OSB MAH.CUMHURİYET CAD.NO:1 POSTA KODU;45030 YUNUSEMRE/MANİSA,info@klimasan.com.tr --- fusun.celebi@klimasan.com.tr,www.klimasan.com.tr,SINIRSIZDIR.,BDO DENET BAĞIMSIZ DENETİM VE DANIŞMANLIK A.Ş.,"BIST METAL EŞYA, MAKİNA / BIST ANA / BIST 500 / BIST TÜM-100 / BIST MANİSA / BIST SINAİ / BIST TÜM",İMALAT / METAL EŞYA MAKİNE ELEKTRİKLİ CİHAZLAR VE ULAŞIM ARAÇLARI,ANA PAZAR
KCAER,KOCAER ÇELİK SANAYİ VE TİCARET A.Ş.,DENİZLİ,GÜRELİ YEMİNLİ MALİ MÜŞAVİRLİK VE BAĞIMSIZ DENETİM HİZMETLERİ A.Ş.,https://www.kap.org.tr/tr/sirket-bilgileri/ozet/3776-kocaer-celik-sanayi-ve-ticaret-a-s,"Gümüşçay Mahallesi, Menderes Bulvari No:45, Merkezefendi, Denizli",yatirimci.iliskileri@kocaersteel.com,www.kocaercelik.com  www.kocaersteel.com,Süresiz,GÜRELİ YEMİNLİ MALİ MÜŞAVİRLİK VE BAĞIMSIZ DENETİM HİZMETLERİ A.Ş.,BIST KATILIM 50 / BIST 100 / BIST SINAİ / BIST METAL ANA / BIST 500 / BIST KATILIM 30 / BIST KATILIM 100 / BIST İZMİR / BIST KATILIM TUM / BIST 100-30 / BIST TÜM / BIST YILDIZ,İMALAT / ANA METAL SANAYİ,YILDIZ PAZAR
KFKTF,KOÇ FIAT KREDİ FİNANSMAN A.Ş.,İSTANBUL,DRT BAĞIMSIZ DENETİM VE SERBEST MUHASEBECİ MALİ MÜŞAVİRLİK A.Ş.,https://www.kap.org.tr/tr/sirket-bilgileri/ozet/1604-koc-fiat-kredi-finansman-a-s,BÜYÜKDERE CADDESİ TOFAŞ HAN NO:145 34394 ŞİŞLİ/İSTANBUL,info@kocfiatkredi.com.tr,www.kocfiatkredi.com.tr,Süresiz,DRT BAĞIMSIZ DENETİM VE SERBEST MUHASEBECİ MALİ MÜŞAVİRLİK A.Ş.,,,KESİN ALIM SATIM PAZARI-(NİTELİKLİ YATIRIMCILAR ARASINDA)
KOCFN,KOÇ FİNANSMAN A.Ş.,İSTANBUL,GÜNEY BAĞIMSIZ DENETİM VE SERBEST MUHASEBECİ MALİ MÜŞAVİRLİK A.Ş.,https://www.kap.org.tr/tr/sirket-bilgileri/ozet/1438-koc-finansman-a-s,"Ünalan Mahallesi, Ayazma Caddesi, Çamlıca İş Merkezi, A Blok, 34700 Üsküdar-İstanbul",ergun@kocfinans.com.tr,www.kocfinans.com.tr,Yoktur,GÜNEY BAĞIMSIZ DENETİM VE SERBEST MUHASEBECİ MALİ MÜŞAVİRLİK A.Ş.,,,KESİN ALIM SATIM PAZARI-(NİTELİKLİ YATIRIMCILAR ARASINDA)
KCHOL,KOÇ HOLDİNG A.Ş.,İSTANBUL,GÜNEY BAĞIMSIZ DENETİM VE SERBEST MUHASEBECİ MALİ MÜŞAVİRLİK A.Ş.,https://www.kap.org.tr/tr/sirket-bilgileri/ozet/1005-koc-holding-a-s,"Nakkaştepe, Azizbey Sokak No.1 Kuzguncuk-İSTANBUL",iletisim@koc.com.tr,www.koc.com.tr,Süresiz,GÜNEY BAĞIMSIZ DENETİM VE SERBEST MUHASEBECİ MALİ MÜŞAVİRLİK A.Ş.,BIST HOLDİNG VE YATIRIM / BIST SÜRDÜRÜLEBİLİRLİK 25 / BIST SÜRDÜRÜLEBİLİRLİK / BIST MALİ / BIST BANKA DIŞI LİKİT 10 / BIST İSTANBUL / BIST YILDIZ / BIST 500 / BIST 50 / BIST TEMETTÜ / BIST TEMETTÜ 25 / BIST 30 / BIST 100 / BIST TÜM,MALİ KURULUŞLAR / HOLDİNGLER VE YATIRIM ŞİRKETLERİ,YILDIZ PAZAR
KOCMT,KOÇ METALURJİ A.Ş.,HATAY,AKADEMİK BAĞIMSIZ DENETİM A.Ş.,https://www.kap.org.tr/tr/sirket-bilgileri/ozet/3409-koc-metalurji-a-s,"Karşı OSB Mahallesi, Demirciler Sokak, Koç Metalurji No:7 İç Kapı No:1 Payas/HATAY",yatirimciiliskileri@kocmetalurji.com.tr,www.kocmetalurji.com.tr,Süresiz.,AKADEMİK BAĞIMSIZ DENETİM A.Ş.,BIST SINAİ / BIST KATILIM TUM / BIST TÜM / BIST TÜM-100 / BIST YILDIZ / BIST HALKA ARZ / BIST 500 / BIST METAL ANA,İMALAT / ANA METAL SANAYİ,YILDIZ PAZAR
KLSYN,KOLEKSİYON MOBİLYA SANAYİ A.Ş.,İSTANBUL,EREN BAĞIMSIZ DENETİM A.Ş.,https://www.kap.org.tr/tr/sirket-bilgileri/ozet/3651-koleksiyon-mobilya-sanayi-a-s,Cumhuriyet Mah. Hacı Osman Bayırı Cad.No: 25 Sarıyer 34457 İSTANBUL,info@koleksiyon.com.tr,www.koleksiyon.com.tr,Süresiz,EREN BAĞIMSIZ DENETİM A.Ş.,"BIST TÜM-100 / BIST ORMAN, KAĞIT, BASIM / BIST GERİ ALIM / BIST 500 / BIST SINAİ / BIST TEKİRDAĞ / BIST TÜM / BIST ANA",İMALAT / ORMAN ÜRÜNLERİ VE MOBİLYA,ANA PAZAR
KNFRT,KONFRUT GIDA SANAYİ VE TİCARET A.Ş.,İSTANBUL,ANALİZ BAĞIMSIZ DENETİM VE DANIŞMANLIK A.Ş.,https://www.kap.org.tr/tr/sirket-bilgileri/ozet/1006-konfrut-gida-sanayi-ve-ticaret-a-s,Cevizli Mahallesi Zuhal Caddesi Ritim İstanbul AVM A3 Blok Apt No: 46C/182 Maltepe/İstanbul,info@konfrut.com.tr,www.konfrut.com.tr,SÜRESİZ,ANALİZ BAĞIMSIZ DENETİM VE DANIŞMANLIK A.Ş.,"BIST SINAİ / BIST TÜM-100 / BIST DENİZLİ / BIST 500 / BIST KATILIM TUM / BIST ANA / BIST GIDA, İÇECEK / BIST TÜM","İMALAT / GIDA, İÇECEK VE TÜTÜN",ANA PAZAR
KONTR,KONTROLMATİK TEKNOLOJİ ENERJİ VE MÜHENDİSLİK A.Ş.,İSTANBUL,GÜRELİ YEMİNLİ MALİ MÜŞAVİRLİK VE BAĞIMSIZ DENETİM HİZMETLERİ A.Ş.,https://www.kap.org.tr/tr/sirket-bilgileri/ozet/5206-kontrolmatik-teknoloji-enerji-ve-muhendislik-a-s,Huzur Mahallesi Ahmet Bayman Cad. No:2 İç Kapı No:2 Sarıyer/İstanbul,info@kontrolmatik.com --- yatirimci.iliskileri@kontrolmatik.com,www.kontrolmatik.com,Süresiz,GÜRELİ YEMİNLİ MALİ MÜŞAVİRLİK VE BAĞIMSIZ DENETİM HİZMETLERİ A.Ş.,BIST 30 / BIST KATILIM TEMETTU / BIST YILDIZ / BIST SÜRDÜRÜLEBİLİRLİK / BIST KURUMSAL YÖNETİM / BIST HİZMETLER / BIST 100 / BIST TÜM / BIST İSTANBUL / BIST KATILIM 50 / BIST KATILIM 100 / BIST KATILIM 30 / BIST 500 / BIST TEMETTÜ / BIST 50 / BIST SÜRDÜRÜLEBİLİRLİK KATILIM / BIST KATILIM TUM,"MESLEKİ, BİLİMSEL VE TEKNİK FAALİYETLER / MİMARLIK VE MÜHENDİSLİK FAALİYETLERİ; TEKNİK MUAYENE VE ANALİZ",YILDIZ PAZAR / KESİN ALIM SATIM PAZARI-(NİTELİKLİ YATIRIMCILAR ARASINDA)
KONYA,KONYA ÇİMENTO SANAYİİ A.Ş.,KONYA,KPMG BAĞIMSIZ DENETİM VE SERBEST MUHASEBECİ MALİ MÜŞAVİRLİK A.Ş.,https://www.kap.org.tr/tr/sirket-bilgileri/ozet/1008-konya-cimento-sanayii-a-s,Horozluhan Mahallesi Cihan Sk. No 15 42300 Selçuklu-KONYA,konyacimento@vicat.com.tr,www.konyacimento.com.tr,"Şirketin Süresi, Şirket'in kuruluşundan başlamak üzere (90) Doksan senedir. Bu süre Genel Kurul kararıyla ve şirket sözleşmesini değiştirmek suretiyle kısaltılıp uzatılabilir. Sürenin uzatılması halinde, bu durum bir Esas Sözleşme değişikliği niteliği taşıdığından Sermaye Piyasası Kurulu'ndan ve Gümrük ve Ticaret Bakanlığı'ndan izin almak gereklidir. (Esas Sözleşme, Madde 6)",KPMG BAĞIMSIZ DENETİM VE SERBEST MUHASEBECİ MALİ MÜŞAVİRLİK A.Ş.,"BIST KATILIM 50 / BIST 100-30 / BIST TAŞ, TOPRAK / BIST 500 / BIST 100 / BIST TÜM / BIST KONYA / BIST KATILIM 100 / BIST YILDIZ / BIST KATILIM TUM / BIST SINAİ",İMALAT / TAŞ VE TOPRAĞA DAYALI,YILDIZ PAZAR
KONKA,KONYA KAĞIT SANAYİ VE TİCARET A.Ş.,KONYA,İRFAN BAĞIMSIZ DENETİM VE YEMİNLİ MALİ MÜŞAVİRLİK A.Ş.,https://www.kap.org.tr/tr/sirket-bilgileri/ozet/3308-konya-kagit-sanayi-ve-ticaret-a-s,2.Organize Sanayi Bölgesi Vezirköy Caddesi No:1 42300 Selçuklu/KONYA,kagit_info@konyakagit.com.tr --- matbaa_info@konyakagit.com.tr,www.konyakagit.com.tr,SINIRSIZ,İRFAN BAĞIMSIZ DENETİM VE YEMİNLİ MALİ MÜŞAVİRLİK A.Ş.,"BIST KATILIM TUM / BIST SINAİ / BIST GERİ ALIM / BIST ORMAN, KAĞIT, BASIM / BIST KONYA / BIST 500 / BIST TÜM-100 / BIST TÜM / BIST YILDIZ",İMALAT / KAĞIT VE KAĞIT ÜRÜNLERİ BASIM,YILDIZ PAZAR
KGYO,KORAY GAYRİMENKUL YATIRIM ORTAKLIĞI A.Ş.,İSTANBUL,VİZYON GRUP BAĞIMSIZ DENETİM.A.Ş.,https://www.kap.org.tr/tr/sirket-bilgileri/ozet/1125-koray-gayrimenkul-yatirim-ortakligi-a-s,Levent Mah. Cömert Sk. Yapı Kredi Plaza Sitesi B Blok No:1B Kat 10 İç Kapı No:26 Beşiktaş-İstanbul,koraygyo@koraygyo.com,www.koraygyo.com,Süresiz,VİZYON GRUP BAĞIMSIZ DENETİM.A.Ş.,BIST GAYRİMENKUL YAT. ORT. / BIST ANA / BIST MALİ / BIST TÜM / BIST KATILIM TUM / BIST TÜM-100 / BIST 500,MALİ KURULUŞLAR / GAYRİMENKUL YATIRIM ORTAKLIKLARI,ANA PAZAR
KORDS,KORDSA TEKNİK TEKSTİL A.Ş.,KOCAELİ,DRT BAĞIMSIZ DENETİM VE SERBEST MUHASEBECİ MALİ MÜŞAVİRLİK A.Ş.,https://www.kap.org.tr/tr/sirket-bilgileri/ozet/1009-kordsa-teknik-tekstil-a-s,"Alikahya Fatih Mahallesi Sanayici Caddesi No: 90 İZMİT 41310 / KOCAELİ
Telefon: 0262 316 70 00 Faks: 0262 316 70 70",info@kordsa.com  --- yatirimciiliskileri@kordsa.com --- investorrelations@kordsa.com,www.kordsa.com,Süresiz,DRT BAĞIMSIZ DENETİM VE SERBEST MUHASEBECİ MALİ MÜŞAVİRLİK A.Ş.,"BIST TEKSTİL, DERİ / BIST KOCAELİ / BIST SINAİ / BIST SÜRDÜRÜLEBİLİRLİK / BIST YILDIZ / BIST TÜM / BIST 500 / BIST TÜM-100","İMALAT / TEKSTİL, GİYİM EŞYASI VE DERİ",YILDIZ PAZAR
KRPLS,KOROPLAST TEMİZLİK AMBALAJ ÜRÜNLERİ SANAYİ VE DIŞ TİCARET A.Ş.,İSTANBUL,DRT BAĞIMSIZ DENETİM VE SERBEST MUHASEBECİ MALİ MÜŞAVİRLİK A.Ş.,https://www.kap.org.tr/tr/sirket-bilgileri/ozet/5593-koroplast-temizlik-ambalaj-urunleri-sanayi-ve-dis-ticaret-a-s,Atatürk Mah.Orhan Veli Cad.No:12/1 Esenyurt - İstanbul,yatirimciiliskileri@koroplast.com,www.koroplast.com,Süresiz,DRT BAĞIMSIZ DENETİM VE SERBEST MUHASEBECİ MALİ MÜŞAVİRLİK A.Ş.,"BIST KİMYA, PETROL, PLASTİK / BIST ANA / BIST SINAİ / BIST KATILIM TUM / BIST İSTANBUL / BIST TÜM / BIST TÜM-100 / BIST 500",İMALAT / KİMYA İLAÇ PETROL LASTİK VE PLASTİK ÜRÜNLER,ANA PAZAR
KORTS,KORTEKS MENSUCAT SANAYİ VE TİCARET A.Ş.,BURSA,ARILAR BAĞIMSIZ DENETİM VE YEMİNLİ MALİ MÜŞAVİRLİK A.Ş.,https://www.kap.org.tr/tr/sirket-bilgileri/ozet/2363-korteks-mensucat-sanayi-ve-ticaret-a-s,Fethiyeosb Mah. Sarı Cadde No: 9 NİLÜFER  / BURSA,korteks.iplik@zorlu.com --- ali.ozmen@zorlu.com,www.korteks.com.tr,Süresiz,ARILAR BAĞIMSIZ DENETİM VE YEMİNLİ MALİ MÜŞAVİRLİK A.Ş.,,,KESİN ALIM SATIM PAZARI-(NİTELİKLİ YATIRIMCILAR ARASINDA)
KOTON,KOTON MAĞAZACILIK TEKSTİL SANAYİ VE TİCARET A.Ş.,İSTANBUL,DRT BAĞIMSIZ DENETİM VE SERBEST MUHASEBECİ MALİ MÜŞAVİRLİK A.Ş.,https://www.kap.org.tr/tr/sirket-bilgileri/ozet/2365-koton-magazacilik-tekstil-sanayi-ve-ticaret-a-s,"Ayazağa Mah. Ayazağa Yolu, No:3 A-B Blok Maslak Sarıyer İstanbul",yatirimci.iliskileri@koton.com --- investor.relations@koton.com,www.koton.com,Süresiz,DRT BAĞIMSIZ DENETİM VE SERBEST MUHASEBECİ MALİ MÜŞAVİRLİK A.Ş.,BIST TİCARET / BIST HALKA ARZ / BIST TÜM / BIST TÜM-100 / BIST KATILIM TUM / BIST 500 / BIST HİZMETLER / BIST YILDIZ,TOPTAN VE PERAKENDE TİCARET / PERAKENDE TİCARET,YILDIZ PAZAR
KOZAL,KOZA ALTIN İŞLETMELERİ A.Ş.,ANKARA,GÜNEY BAĞIMSIZ DENETİM VE SERBEST MUHASEBECİ MALİ MÜŞAVİRLİK A.Ş.,https://www.kap.org.tr/tr/sirket-bilgileri/ozet/1500-koza-altin-isletmeleri-a-s,"UĞUR MUMCU MAHALLESİ,FATİH SULTAN MEHMET BULVARI (İSTANBUL YOLU) 10.KM NO:310 YENİMAHALLE/ANKARA",yatirimciiliskileri@kozagold.com,www.kozaaltin.com.tr,SÜRESİZ,GÜNEY BAĞIMSIZ DENETİM VE SERBEST MUHASEBECİ MALİ MÜŞAVİRLİK A.Ş.,BIST MADENCİLİK / BIST 500 / BIST TÜM / BIST SINAİ / BIST 50 / BIST 30 / BIST İZMİR / BIST 100 / BIST YILDIZ / BIST GERİ ALIM,MADENCİLİK VE TAŞ OCAKÇILIĞI / METAL CEVHERİ MADENCİLİĞİ,YILDIZ PAZAR
KOZAA,KOZA ANADOLU METAL MADENCİLİK İŞLETMELERİ A.Ş.,ANKARA,GÜNEY BAĞIMSIZ DENETİM VE SERBEST MUHASEBECİ MALİ MÜŞAVİRLİK A.Ş.,https://www.kap.org.tr/tr/sirket-bilgileri/ozet/1010-koza-anadolu-metal-madencilik-isletmeleri-a-s,UĞUR MUMCU MAHALLESİ FATİH SULTAN MEHMET BULVARI (İSTANBUL YOLU) 10.KM NO:310 YENİMAHALLE/ANKARA,yatirimciiliskileri@kozagold.com,http://www.kozametal.com.tr,SÜRESİZ,GÜNEY BAĞIMSIZ DENETİM VE SERBEST MUHASEBECİ MALİ MÜŞAVİRLİK A.Ş.,BIST ANKARA / BIST MADENCİLİK / BIST SINAİ / BIST 100-30 / BIST 500 / BIST 100 / BIST TÜM / BIST YILDIZ,MADENCİLİK VE TAŞ OCAKÇILIĞI / METAL CEVHERİ MADENCİLİĞİ,YILDIZ PAZAR
KOPOL,KOZA POLYESTER SANAYİ VE TİCARET A.Ş.,GAZİANTEP,PKF ADAY BAĞIMSIZ DENETİM A.Ş.,https://www.kap.org.tr/tr/sirket-bilgileri/ozet/5806-koza-polyester-sanayi-ve-ticaret-a-s,Başpınar (Organize) OSB Mahallesi O.S.B. 4.Bölge 83414 Nolu Cadde No: 30 - Şehitkamil / Gaziantep,yatirimci@kozapolyester.com.tr,www.kozapolyester.com.tr,Süresiz,PKF ADAY BAĞIMSIZ DENETİM A.Ş.,"BIST 500 / BIST YILDIZ / BIST KATILIM TUM / BIST KATILIM 100 / BIST SINAİ / BIST TÜM-100 / BIST KİMYA, PETROL, PLASTİK / BIST HALKA ARZ / BIST TÜM",İMALAT / KİMYA İLAÇ PETROL LASTİK VE PLASTİK ÜRÜNLER,YILDIZ PAZAR
KRGYO,KÖRFEZ GAYRİMENKUL YATIRIM ORTAKLIĞI A.Ş.,İSTANBUL,DRT BAĞIMSIZ DENETİM VE SERBEST MUHASEBECİ MALİ MÜŞAVİRLİK A.Ş.,https://www.kap.org.tr/tr/sirket-bilgileri/ozet/1610-korfez-gayrimenkul-yatirim-ortakligi-a-s,Altunizade Mahallesi Kısıklı Caddesi Aköz İş Merkezi Blok No: 14/1 İç Kapı No: 5 Üsküdar / İstanbul,info@korfezgyo.com.tr,www.korfezgyo.com.tr,Süresizdir,DRT BAĞIMSIZ DENETİM VE SERBEST MUHASEBECİ MALİ MÜŞAVİRLİK A.Ş.,BIST TÜM-100 / BIST KATILIM TUM / BIST MALİ / BIST ANA / BIST GAYRİMENKUL YAT. ORT. / BIST 500 / BIST TÜM,MALİ KURULUŞLAR / GAYRİMENKUL YATIRIM ORTAKLIKLARI,ANA PAZAR
KRSTL,KRİSTAL KOLA VE MEŞRUBAT SANAYİ TİCARET A.Ş.,İSTANBUL,YORUM BAĞIMSIZ DENETİM A.Ş.,https://www.kap.org.tr/tr/sirket-bilgileri/ozet/1011-kristal-kola-ve-mesrubat-sanayi-ticaret-a-s,Bahçelievler Mahallesi Fevzi Çakmak 2 Caddesi Güzelşehir Sitesi No:1 AJ Büyükçekmece/İSTANBUL,info@kristalkola.com.tr,www.kristalkola.com.tr,Süresiz,YORUM BAĞIMSIZ DENETİM A.Ş.,"BIST TÜM / BIST BALIKESİR / BIST GIDA, İÇECEK / BIST TÜM-100 / BIST ANA / BIST 500 / BIST KATILIM TUM / BIST SINAİ","İMALAT / GIDA, İÇECEK VE TÜTÜN",ANA PAZAR
KRONT,KRON TEKNOLOJİ A.Ş.,İSTANBUL,KAVRAM BAĞIMSIZ DENETİM VE DANIŞMANLIK A.Ş.,https://www.kap.org.tr/tr/sirket-bilgileri/ozet/1547-kron-teknoloji-a-s,"İ.T.Ü. Ayazağa Kampüsü, Koru Yolu, ARI 3 Binası, Teknokent, No:B401, 34469 Maslak - İstanbul",yatirimci@krontech.com,"www.kron.com.tr , www.krontech.com",Süresiz,KAVRAM BAĞIMSIZ DENETİM VE DANIŞMANLIK A.Ş.,BIST ANA / BIST BİLİŞİM / BIST TÜM / BIST TEKNOLOJİ / BIST KATILIM TUM / BIST TÜM-100 / BIST 500 / BIST İSTANBUL,TEKNOLOJİ / BİLİŞİM,ANA PAZAR
KTKVK,KT KİRA SERTİFİKALARI VARLIK KİRALAMA A.Ş.,İSTANBUL,DRT BAĞIMSIZ DENETİM VE SERBEST MUHASEBECİ MALİ MÜŞAVİRLİK A.Ş.,https://www.kap.org.tr/tr/sirket-bilgileri/ozet/2058-kt-kira-sertifikalari-varlik-kiralama-a-s,"Büyükdere Cad, No:129-1 Kat:3 Esentepe/ Şişli- İstanbul - TÜRKİYE",info@ktksvks.com.tr,www.ktksvks.com.tr,Süresiz,DRT BAĞIMSIZ DENETİM VE SERBEST MUHASEBECİ MALİ MÜŞAVİRLİK A.Ş.,,,KESİN ALIM SATIM PAZARI-(NİTELİKLİ YATIRIMCILAR ARASINDA)
KSTUR,KUŞTUR KUŞADASI TURİZM ENDÜSTRİSİ A.Ş.,AYDIN,KAVRAM BAĞIMSIZ DENETİM VE DANIŞMANLIK A.Ş.,https://www.kap.org.tr/tr/sirket-bilgileri/ozet/1588-kustur-kusadasi-turizm-endustrisi-a-s,BAYRAKLI DEDE MAHALLESİ / KUŞTUR TATİL KÖYÜ KUŞADASI / AYDIN,muhasebe@kusturclub.com,www.kusturclub.com,ŞİRKETİN SÜRESİ SINIRSIZDIR.,KAVRAM BAĞIMSIZ DENETİM VE DANIŞMANLIK A.Ş.,BIST TÜM-100 / BIST TÜM,OTELLER VE LOKANTALAR / KONAKLAMA,PİYASA ÖNCESİ İŞLEM PLATFORMU
KUVVA,KUVVA GIDA TİCARET VE SANAYİ YATIRIMLARI A.Ş.,İSTANBUL,ELİT BAĞIMSIZ DENETİM VE YEMİNLİ MALİ MÜŞAVİRLİK A.Ş.,https://www.kap.org.tr/tr/sirket-bilgileri/ozet/1070-kuvva-gida-ticaret-ve-sanayi-yatirimlari-a-s,Söğütlüçeşme Mah. 1. Fevzi Çakmak Cad. No. 16. İç Kapı No.1 Küçükçekmece/ İstanbul,serve@serve.com.tr,www.serve.com.tr,Süresiz,ELİT BAĞIMSIZ DENETİM VE YEMİNLİ MALİ MÜŞAVİRLİK A.Ş.,,TOPTAN VE PERAKENDE TİCARET / TOPTAN TİCARET,YAKIN İZLEME PAZARI
KUYAS,KUYAŞ YATIRIM A.Ş.,İSTANBUL,AKADEMİK BAĞIMSIZ DENETİM A.Ş.,https://www.kap.org.tr/tr/sirket-bilgileri/ozet/1619-kuyas-yatirim-a-s,Yeşilköy Mahallesi Serbesti Caddesi No:11/1 Bakırköy / İstanbul,info@kuyas.com.tr,www.kuyas.com.tr,SÜRESİZDİR.,AKADEMİK BAĞIMSIZ DENETİM A.Ş.,BIST YILDIZ / BIST HİZMETLER / BIST KATILIM TUM / BIST TÜM-100 / BIST TÜM / BIST GERİ ALIM / BIST İSTANBUL / BIST 500 / BIST İNŞAAT,İNŞAAT VE BAYINDIRLIK / İNŞAAT VE BAYINDIRLIK İŞLERİ,YILDIZ PAZAR
KBORU,KUZEY BORU A.Ş.,AKSARAY,GÜNCEL BAĞIMSIZ DENETİM DANIŞMANLIK A.Ş.,https://www.kap.org.tr/tr/sirket-bilgileri/ozet/5911-kuzey-boru-a-s,KIRIMLI OSB MAH. MEHMETÇİK BUL. NO: 2 MERKEZ AKSARAY,yatirimci.iliskileri@kuzeyboru.com.tr,www.kuzeyboru.com.tr ; https://kuzeyboruyatirimciiliskileri.com/,SÜRESİZ,GÜNCEL BAĞIMSIZ DENETİM DANIŞMANLIK A.Ş.,"BIST TÜM / BIST HALKA ARZ / BIST TÜM-100 / BIST 500 / BIST KİMYA, PETROL, PLASTİK / BIST SINAİ / BIST YILDIZ / BIST KATILIM TUM / BIST KATILIM 100",İMALAT / KİMYA İLAÇ PETROL LASTİK VE PLASTİK ÜRÜNLER,YILDIZ PAZAR
KZGYO,KUZUGRUP GAYRİMENKUL YATIRIM ORTAKLIĞI A.Ş.,İSTANBUL,VİZYON GRUP BAĞIMSIZ DENETİM.A.Ş.,https://www.kap.org.tr/tr/sirket-bilgileri/ozet/5857-kuzugrup-gayrimenkul-yatirim-ortakligi-a-s,Yenibosna Merkez Mah. 1. Asena Sok. F Sitesi Kuzu34 Plaza No 25 İç Kapı No 1 34197 Bahçelievler-İstanbul,info@kzgyo.com,www.kzgyo.com,Süresiz,VİZYON GRUP BAĞIMSIZ DENETİM.A.Ş.,BIST HALKA ARZ / BIST 500 / BIST TÜM-100 / BIST MALİ / BIST TÜM / BIST GAYRİMENKUL YAT. ORT. / BIST YILDIZ,MALİ KURULUŞLAR / GAYRİMENKUL YATIRIM ORTAKLIKLARI,YILDIZ PAZAR
KUTPO,KÜTAHYA PORSELEN SANAYİ A.Ş.,KÜTAHYA,RAM BAĞIMSIZ DENETİM VE DANIŞMANLIK A.Ş.,https://www.kap.org.tr/tr/sirket-bilgileri/ozet/1012-kutahya-porselen-sanayi-a-s,ESKİŞEHİR KARAYOLU 8. KM. 43001 KÜTAHYA,iletisim@kutahyaporselen.com.tr,www.kutahyaporselen.com.tr,Süresiz,RAM BAĞIMSIZ DENETİM VE DANIŞMANLIK A.Ş.,"BIST TAŞ, TOPRAK / BIST ANA / BIST TÜM-100 / BIST KATILIM TUM / BIST 500 / BIST TÜM / BIST SINAİ",İMALAT / TAŞ VE TOPRAĞA DAYALI,ANA PAZAR
